{
  "id": "sc-post-matric-scholarship",
  "category": "education",
  "last_verified": "2026-10-20",
  "rule_version": "1.0.0",
  "name": {
    "en": "Post-Matric Scholarship for SC Students",
    "hi": "अनुसूचित जाति विद्यार्थियों के लिए पोस्ट-मैट्रिक छात्रवृत्ति"
  },
  "level": "central",
  "states": [
    "*"
  ],
  "benefit": {
    "en": "Reimbursement of compulsory non-refundable fees (including tuition fee) plus a yearly academic allowance of Rs 4,000 to Rs 13,500 depending on course group and hostel or day scholar (10 percent extra for students with disability).",
    "hi": "अनिवार्य गैर-वापसी योग्य फीस (ट्यूशन फीस सहित) की भरपाई और कोर्स समूह तथा हॉस्टल या डे-स्कॉलर के अनुसार सालाना ₹4,000 से ₹13,500 का शैक्षणिक भत्ता (दिव्यांग विद्यार्थियों को 10 प्रतिशत अधिक)।"
  },
  "benefit_weight": 50,
  "description": {
    "en": "Central scheme of the Ministry of Social Justice and Empowerment for SC students studying after Class 10 in recognised institutions. Paid through the state or UT where the student is domiciled, via the National Scholarship Portal.",
    "hi": "सामाजिक न्याय एवं अधिकारिता मंत्रालय की केंद्रीय योजना, जो दसवीं के बाद मान्यता प्राप्त संस्थानों में पढ़ने वाले अनुसूचित जाति के विद्यार्थियों के लिए है। राशि अपने मूल राज्य के माध्यम से राष्ट्रीय छात्रवृत्ति पोर्टल से मिलती है।"
  },
  "eligibility": {
    "all": [
      {
        "field": "category",
        "op": "eq",
        "value": "sc"
      },
      {
        "field": "student_level",
        "op": "in",
        "value": [
          "school_11_12",
          "undergrad",
          "postgrad"
        ]
      },
      {
        "field": "annual_income",
        "op": "lte",
        "value": 250000
      }
    ]
  },
  "eligibility_plain": {
    "en": [
      "You belong to a Scheduled Caste",
      "You are studying in Class 11 or above (post-matric)",
      "Your parents' or guardians' total yearly income is Rs 2.5 lakh or less"
    ],
    "hi": [
      "आप अनुसूचित जाति से हैं",
      "आप कक्षा 11 या उससे ऊपर पढ़ रहे हैं",
      "माता-पिता या अभिभावक की कुल सालाना आय ₹2.5 लाख या उससे कम है"
    ]
  },
  "documents": [
    {
      "name": {
        "en": "Aadhaar number",
        "hi": "आधार संख्या"
      },
      "required": true
    },
    {
      "name": {
        "en": "Caste certificate",
        "hi": "जाति प्रमाण पत्र"
      },
      "required": true
    },
    {
      "name": {
        "en": "Income certificate",
        "hi": "आय प्रमाण पत्र"
      },
      "required": true
    },
    {
      "name": {
        "en": "Marksheet of last qualifying exam",
        "hi": "पिछली परीक्षा की अंकतालिका"
      },
      "required": true
    },
    {
      "name": {
        "en": "Domicile or residence proof",
        "hi": "निवास प्रमाण पत्र"
      },
      "required": true
    },
    {
      "name": {
        "en": "Bank account linked with Aadhaar and mobile",
        "hi": "आधार और मोबाइल से जुड़ा बैंक खाता"
      },
      "required": true
    }
  ],
  "how_to_apply": {
    "en": [
      "Do One-Time Registration on the National Scholarship Portal",
      "Choose the Post-Matric Scholarship for SC students and fill the form",
      "Upload documents; the institute and state officers verify; money comes by DBT"
    ],
    "hi": [
      "राष्ट्रीय छात्रवृत्ति पोर्टल पर वन-टाइम रजिस्ट्रेशन करें",
      "अनुसूचित जाति के लिए पोस्ट-मैट्रिक छात्रवृत्ति चुनकर फॉर्म भरें",
      "दस्तावेज़ अपलोड करें; संस्थान और राज्य अधिकारी जाँच करेंगे; पैसा सीधे बैंक खाते में आएगा"
    ]
  },
  "apply_url": "https://scholarships.gov.in/",
  "source_url": "https://scholarships.gov.in/public/schemeGuidelines/Manipur_state_scheme/manipur_3032_G.pdf",
  "deadline": null,
  "tags": [
    "scholarship",
    "SC",
    "post matric",
    "छात्रवृत्ति",
    "अनुसूचित जाति",
    "पोस्ट मैट्रिक",
    "education",
    "student"
  ],
  "verification": {
    "status": "sourced",
    "by": null,
    "hi_reviewed": false,
    "notes": "FIX 2026-10-20 (data audit): the earlier Rs 230 to 1,200 per month figure came from an older scale and is NOT in the current SC guidelines. Opened official guideline PDF 'Post Matric Scholarships to students belonging to Scheduled Castes for studies in India (2020-21 to 2025-26)', Dept of Social Justice and Empowerment, March 2021 (hosted on scholarships.gov.in): income up to Rs 2.50 lakh (para 6.2); academic allowance per year, hostellers / day scholars: Group 1 Rs 13,500 / 7,000, Group 2 Rs 9,500 / 6,500, Group 3 Rs 6,000 / 3,000, Group 4 Rs 4,000 / 2,500; 10 percent extra for Divyang students; allowance is linked to CPI so current rates may be slightly higher. The guideline period ends 2025-26; a 2026-27 revision was not found, so confirm on the National Scholarship Portal. Income ceiling Rs 2.5 lakh also confirmed in PIB release 12 Aug 2026 https://www.pib.gov.in/PressReleasePage.aspx?PRID=2298357. Level mapped to class 11 onwards (post-matric). Domicile state decides who pays; states=* is used. Courses must be recognised; marks rules not encoded."
  }
}
