{
 "id": "fx-health-cover",
 "name": {
  "en": "Fixture Health Cover",
  "hi": "फिक्स्चर स्वास्थ्य कवर"
 },
 "category": "health",
 "level": "central",
 "states": [
  "*"
 ],
 "benefit": {
  "en": "Fixture Health Cover benefit text",
  "hi": "फिक्स्चर स्वास्थ्य कवर लाभ"
 },
 "benefit_weight": 65,
 "description": {
  "en": "Fixture scheme",
  "hi": "परीक्षण योजना"
 },
 "eligibility": {
  "all": [
   {
    "field": "annual_income",
    "op": "lte",
    "value": 500000
   }
  ]
 },
 "eligibility_plain": {
  "en": [
   "Fixture rule"
  ],
  "hi": [
   "परीक्षण नियम"
  ]
 },
 "documents": [
  {
   "name": {
    "en": "Aadhaar"
   },
   "required": true
  }
 ],
 "how_to_apply": {
  "en": [
   "Apply online"
  ],
  "hi": [
   "ऑनलाइन आवेदन करें"
  ]
 },
 "apply_url": null,
 "source_url": "https://example.gov.in/fx-health-cover",
 "deadline": null,
 "last_verified": "2026-10-20",
 "rule_version": "1.0.0",
 "tags": [
  "health"
 ],
 "verification": {
  "status": "sourced",
  "by": null,
  "hi_reviewed": false
 }
}